{
  "format": "qrsd-v1",
  "volume_id": "urn:uuid:7f0e2a9b-3c17-4e99-94aa-000000000001",
  "created_at": "2026-06-27T00:00:00Z",
  "data_plane": {
    "cipher": "AES-256-XTS",
    "xts_raw_key_bits": 512,
    "sector_size": 4096,
    "integrity": {
      "mode": "none",
      "alternatives": [
        "dm-verity",
        "fs-verity",
        "dm-integrity-aead"
      ]
    }
  },
  "boot_policy": {
    "policy_id": "policy-prod-laptop-v4",
    "secure_boot_required": true,
    "measured_boot_required": true,
    "pcr_profile": [
      "7",
      "11"
    ],
    "minimum_boot_manifest_version": 42,
    "rollback_protection": {
      "type": "tpm-nv-counter-or-kms-monotonic",
      "counter_name": "boot_policy_counter"
    }
  },
  "key_hierarchy": {
    "volume_master_key_version": 3,
    "active_dek_version": 8,
    "keyslots": [
      {
        "slot": 0,
        "status": "active",
        "kind": "argon2id_passphrase",
        "kdf": {
          "algorithm": "argon2id",
          "memory_kib": 1048576,
          "time_cost": 4,
          "parallelism": 4
        },
        "wrap": {
          "algorithm": "aes-256-kw",
          "wrapped_key_ref": "blob:slot0"
        }
      },
      {
        "slot": 1,
        "status": "active",
        "kind": "tpm2_sealed",
        "pcrs": [
          "7",
          "11"
        ],
        "requires_pin": true,
        "signed_pcr_policy": true
      },
      {
        "slot": 2,
        "status": "active",
        "kind": "hybrid_remote_kms",
        "kem": {
          "classical": "x25519",
          "pqc": "ml-kem-768",
          "combiner": "hkdf-sha384"
        },
        "attestation": {
          "required": true,
          "accepted_tee": [
            "tpm2",
            "amd-sev-snp-vtpm"
          ],
          "measurement_policy_ref": "manifest-prod-v42"
        }
      },
      {
        "slot": 3,
        "status": "disabled_until_break_glass",
        "kind": "threshold_recovery",
        "scheme": "shamir",
        "m": 3,
        "n": 5
      }
    ]
  },
  "signatures": [
    {
      "purpose": "disk-manifest",
      "algorithm": "ml-dsa-65",
      "key_id": "disk-pq",
      "signature_ref": "900be4003ebd77c3bedaeab583dd15e5fb86d830a768667a37044cd9355cba2ec26cdc5291cf91c7f0b81861b6d18a9efdf3f25a3ba9d8c2559aaa65288b7077e2dee83714b464619385a706b7465ceefdf3f25a3ba9d8c2559aaa65288b7077e2dee83714b464619385a706b7465ceefdf3f25a3ba9d8c2559aaa65288b7077e2dee83714b464619385a706b7465ceefdf3f25a3ba9d8c2559aaa65288b7077e2dee83714b464619385a706b7465ceefdf3f25a3ba9d8c2559aaa65288b7077e2dee83714b464619385a706b7465ceefdf3f25a3ba9d8c2559aaa65288b7077e2dee83714b464619385a706b7465ceefdf3f25a3ba9d8c2559aaa65288b7077e2dee83714b464619385a706b7465ceefdf3f25a3ba9d8c2559aaa65288b7077e2dee83714b464619385a706b7465ceefdf3f25a3ba9d8c2559aaa65288b7077e2dee83714b464619385a706b7465ceefdf3f25a3ba9d8c2559aaa65288b7077e2dee83714b464619385a706b7465ceefdf3f25a3ba9d8c2559aaa65288b7077e2dee83714b464619385a706b7465ceefdf3f25a3ba9d8c2559aaa65288b7077e2dee83714b464619385a706b7465ceefdf3f25a3ba9d8c2559aaa65288b7077e2dee83714b464619385a706b7465ceefdf3f25a3ba9d8c2559aaa65288b7077e2dee83714b464619385a706b7465ceefdf3f25a3ba9d8c2559aaa65288b7077e2dee83714b464619385a706b7465ceefdf3f25a3ba9d8c2559aaa65288b7077e2dee83714b464619385a706b7465ceefdf3f25a3ba9d8c2559aaa65288b7077e2dee83714b464619385a706b7465ceefdf3f25a3ba9d8c2559aaa65288b7077e2dee83714b464619385a706b7465ceefdf3f25a3ba9d8c2559aaa65288b7077e2dee83714b464619385a706b7465ceefdf3f25a3ba9d8c2559aaa65288b7077e2dee83714b464619385a706b7465ceefdf3f25a3ba9d8c2559aaa65288b7077e2dee83714b464619385a706b7465ceefdf3f25a3ba9d8c2559aaa65288b7077e2dee83714b464619385a706b7465ceefdf3f25a3ba9d8c2559aaa65288b7077e2dee83714b464619385a706b7465ceefdf3f25a3ba9d8c2559aaa65288b7077e2dee83714b464619385a706b7465ceefdf3f25a3ba9d8c2559aaa65288b7077e2dee83714b464619385a706b7465ceefdf3f25a3ba9d8c2559aaa65288b7077e2dee83714b464619385a706b7465ceefdf3f25a3ba9d8c2559aaa65288b7077e2dee83714b464619385a706b7465ceefdf3f25a3ba9d8c2559aaa65288b7077e2dee83714b464619385a706b7465ceefdf3f25a3ba9d8c2559aaa65288b7077e2dee83714b464619385a706b7465ceefdf3f25a3ba9d8c2559aaa65288b7077e2dee83714b464619385a706b7465ceefdf3f25a3ba9d8c2559aaa65288b7077e2dee83714b464619385a706b7465ceefdf3f25a3ba9d8c2559aaa65288b7077e2dee83714b464619385a706b7465ceefdf3f25a3ba9d8c2559aaa65288b7077e2dee83714b464619385a706b7465ceefdf3f25a3ba9d8c2559aaa65288b7077e2dee83714b464619385a706b7465ceefdf3f25a3ba9d8c2559aaa65288b7077e2dee83714b464619385a706b7465ceefdf3f25a3ba9d8c2559aaa65288b7077e2dee83714b464619385a706b7465ceefdf3f25a3ba9d8c2559aaa65288b7077e2dee83714b464619385a706b7465ceefdf3f25a3ba9d8c2559aaa65288b7077e2dee83714b464619385a706b7465ceefdf3f25a3ba9d8c2559aaa65288b7077e2dee83714b464619385a706b7465ceefdf3f25a3ba9d8c2559aaa65288b7077e2dee83714b464619385a706b7465ceefdf3f25a3ba9d8c2559aaa65288b7077e2dee83714b464619385a706b7465ceefdf3f25a3ba9d8c2559aaa65288b7077e2dee83714b464619385a706b7465ceefdf3f25a3ba9d8c2559aaa65288b7077e2dee83714b464619385a706b7465ceefdf3f25a3ba9d8c2559aaa65288b7077e2dee83714b464619385a706b7465ceefdf3f25a3ba9d8c2559aaa65288b7077e2dee83714b464619385a706b7465ceefdf3f25a3ba9d8c2559aaa65288b7077e2dee83714b464619385a706b7465ceefdf3f25a3ba9d8c2559aaa65288b7077e2dee83714b464619385a706b7465ceefdf3f25a3ba9d8c2559aaa65288b7077e2dee83714b464619385a706b7465ceefdf3f25a3ba9d8c2559aaa65288b7077e2dee83714b464619385a706b7465ceefdf3f25a3ba9d8c2559aaa65288b7077e2dee83714b464619385a706b7465ceefdf3f25a3ba9d8c2559aaa65288b7077e2dee83714b464619385a706b7465ceefdf3f25a3ba9d8c2559aaa65288b7077e2dee83714b464619385a706b7465ceefdf3f25a3ba9d8c2559aaa65288b7077e2dee83714b464619385a706b7465ceefdf3f25a3ba9d8c2559aaa65288b7077e2dee83714b464619385a706b7465ceefdf3f25a3ba9d8c2559aaa65288b7077e2dee83714b464619385a706b7465ceefdf3f25a3ba9d8c2559aaa65288b7077e2dee83714b464619385a706b7465ceefdf3f25a3ba9d8c2559aaa65288b7077e2dee83714b464619385a706b7465ceefdf3f25a3ba9d8c2559aaa65288b7077e2dee83714b464619385a706b7465ceefdf3f25a3ba9d8c2559aaa65288b7077e2dee83714b464619385a706b7465ceefdf3f25a3ba9d8c2559aaa65288b7077e2dee83714b464619385a706b7465ceefdf3f25a3ba9d8c2559aaa65288b7077e2dee83714b464619385a706b7465ceefdf3f25a3ba9d8c2559aaa65288b7077e2dee83714b464619385a706b7465ceefdf3f25a3ba9d8c2559aaa65288b7077e2dee83714b464619385a706b7465ceefdf3f25a3ba9d8c2559aaa65288b7077e2dee83714b464619385a706b7465ceefdf3f25a3ba9d8c2559aaa65288b7077e2dee83714b464619385a706b7465ceefdf3f25a3ba9d8c2559aaa65288b7077e2dee83714b464619385a706b7465ceefdf3f25a3ba9d8c2559aaa65288b7077e2dee83714b464619385a706b7465ceefdf3f25a3ba9d8c2559aaa65288b7077e2dee83714b464619385a706b7465ceefdf3f25a3ba9d8c2559aaa65288b7077e2dee83714b464619385a706b7465ceefdf3f25a3ba9d8c2559aaa65288b7077e2dee83714b464619385a706b7465ceefdf3f25a3ba9d8c2559aaa65288b7077e2dee83714b464619385a706b7465ceefdf3f25a3ba9d8c2559aaa65288b7077e2dee83714b464619385a706b7465ceefdf3f25a3ba9d8c2559aaa65288b7077e2dee83714b464619385a706b7465ceefdf3f25a3ba9d8c2559aaa65288b7077e2dee83714b464619385a706b7465ceefdf3f25a3ba9d8c2559aaa65288b7077e2dee83714b464619385a706b7465ceefdf3f25a3ba9d8c2559aaa65288b7077e2dee83714b464619385a706b7465ceefdf3f25a3ba9d8c2559aaa65288b7077e2dee83714b464619385a706b7465ceefdf3f25a3ba9d8c2559aaa65288b7077e2dee83714b464619385a706b7465ceefdf3f25a3ba9d8c2559aaa65288b7077e2dee83714b464619385a706b7465ceefdf3f25a3ba9d8c2559aaa65288b7077e2dee83714b464619385a706b7465ceefdf3f25a3ba9d8c2559aaa65288b7077e2dee83714b464619385a706b7465ceefdf3f25a3ba9d8c2559aaa65288b7077e2dee83714b464619385a706b7465ceefdf3f25a3ba9d8c2559aaa65288b7077e2dee83714b464619385a706b7465ceefdf3f25a3ba9d8c2559aaa65288b7077e2dee83714b464619385a706b7465ceefdf3f25a3ba9d8c2559aaa65288b7077e2dee83714b464619385a706b7465ceefdf3f25a3ba9d8c2559aaa65288b7077e2dee83714b464619385a706b7465ceefdf3f25a3ba9d8c2559aaa65288b7077e2dee83714b464619385a706b7465ceefdf3f25a3ba9d8c2559aaa65288b7077e2dee83714b464619385a706b7465ceefdf3f25a3ba9d8c2559aaa65288b7077e2dee83714b464619385a706b7465ceefdf3f25a3ba9d8c2559aaa65288b7077e2dee83714b464619385a706b7465ceefdf3f25a3ba9d8c2559aaa65288b7077e2dee83714b464619385a706b7465ceefdf3f25a3ba9d8c2559aaa65288b7077e2dee83714b464619385a706b7465ceefdf3f25a3ba9d8c2559aaa65288b7077e2dee83714b464619385a706b7465ceefdf3f25a3ba9d8c2559aaa65288b7077e2dee83714b464619385a706b7465ceefdf3f25a3ba9d8c2559aaa65288b7077e2dee83714b464619385a706b7465ceefdf3f25a3ba9d8c2559aaa65288b7077e2dee83714b464619385a706b7465ceefdf3f25a3ba9d8c2559aaa65288b7077e2dee83714b464619385a706b7465ceefdf3f25a3ba9d8c2559aaa65288b7077e2dee83714b464619385a706b7465ceefdf3f25a3ba9d8c2559aaa65288b7077e2dee83714b464619385a706b7465ceefdf3f25a3ba9d8c2559aaa65288b7077e2dee83714b464619385a706b7465ceefdf3f25a3ba9d8c2559aaa65288b7077e2dee83714b464619385a706b7465ceefdf3f25a3ba9d8c2559aaa65288b7077e2dee83714b464619385a706b7"
    },
    {
      "purpose": "classical-compatibility",
      "algorithm": "ecdsa-p384",
      "key_id": "disk-classical",
      "signature_ref": "c0c3e184b348916f030e6de632ebc70791b3edb3cb1c9a0671a1944f564ab26f559b0cb4ba59333063b8399e1b9d0d23b986d6b1729d237fda970b66ca1e59ca4239ae1a095978e0ba1f9b892552df4cb986d6b1729d237fda970b66ca1e59ca4239ae1a095978e0"
    }
  ],
  "audit": {
    "last_rotation": "2026-06-27T00:00:00Z",
    "last_attested_unlock_receipt": "rcpt-000000-0000000000000000",
    "log_chain": "sha384:0000000000000000000000000000000000000000000000000000000000000000000000000000000000000000000000"
  }
}
